{
  "descritor": {
    "municipio": 7107,
    "entidade": 10048,
    "numeroEmpenho": "12345",
    "anoEmpenho": 2024,
    "retificacao": false
  },
  "codigoContrato": "202410227000",
  "dataEmissaoEmpenho": "2024-10-10",
  "valorTotal": 15000.5000,
  "tipoPessoa": "PJ",
  "niCredorFornecedor": "12345678000199",
  "nomeCredorFornecedor": "Empresa Exemplo Ltda",
  "codigoNaturezaDespesa": "33903000",
  "fonteRecurso": 1
}